title,abbr,key,slug,category,parent,parent_key,description,url,jurisdiction,jurisdiction_code,source,source_url,source_description,address,contact,email,tags,created_at,updated_at
IRB-Brasil Resseguros S/A,IRB-Brasil Re,br/irb-brasil-resseguros-sa,irb-brasil-resseguros-sa,,Ministério da Fazenda,br/ministerio-fazenda,,http://www.irb-brasilre.com.br/mail_frame.htm,Brazil,BR,SIORG XML Extraction,http://repositorio.dados.gov.br/governo-politica/administracao-publica/estrutura-organizacional/,,"AV. MARECHAL CÂMARA, N 171, 8 ANDAR - CENTRO, Rio de Janeiro, RJ, Brasil",,,,2003-03-24,2013-04-22T09:04:54
"Ministério da Agricultura, Pecuária e Abastecimento",MAPA,br/ministerio-agricultura-pecuaria-abastecimento,ministerio-agricultura-pecuaria-abastecimento,,Presidência da República,br/presidencia-republica,,http://www.agricultura.gov.br/,Brazil,BR,SIORG XML Extraction,http://repositorio.dados.gov.br/governo-politica/administracao-publica/estrutura-organizacional/,,"Esplanada dos Ministérios, Bloco D, 8º Andar, Brasília, DF, Brasil",,,,2010-03-04,2013-04-22T09:04:54
Ministério das Cidades,MCIDADES,br/ministerio-cidades,ministerio-cidades,,Presidência da República,br/presidencia-republica,,www.cidades.gov.br,Brazil,BR,SIORG XML Extraction,http://repositorio.dados.gov.br/governo-politica/administracao-publica/estrutura-organizacional/,,"Quadra 01, Lote 01/06, Bloco H, Ed. Telemundi II , Brasília, DF, Brasil",,,,2003-04-03,2013-04-22T09:04:54
"Ministério da Ciência, Tecnologia e Inovação",MCTI,br/ministerio-ciencia-tecnologia-inovacao,ministerio-ciencia-tecnologia-inovacao,,Presidência da República,br/presidencia-republica,,http://www.mct.gov.br/,Brazil,BR,SIORG XML Extraction,http://repositorio.dados.gov.br/governo-politica/administracao-publica/estrutura-organizacional/,,"Esplanada dos Ministérios, Bloco E, 4º Andar, Brasília, DF, Brasil",,,,2006-09-06,2013-04-22T09:04:54
Ministério das Comunicações,MC,br/ministerio-comunicacoes,ministerio-comunicacoes,,Presidência da República,br/presidencia-republica,,http://www.mc.gov.br/,Brazil,BR,SIORG XML Extraction,http://repositorio.dados.gov.br/governo-politica/administracao-publica/estrutura-organizacional/,,"Esplanada dos Ministérios, Bloco R, 8º Andar sala 800, Brasília, DF, Brasil",,,,2011-04-19,2013-04-22T09:04:54
Ministério da Cultura,MinC,br/ministerio-cultura,ministerio-cultura,,Presidência da República,br/presidencia-republica,,http://www.cultura.gov.br/,Brazil,BR,SIORG XML Extraction,http://repositorio.dados.gov.br/governo-politica/administracao-publica/estrutura-organizacional/,,"Esplanada dos Ministérios, Bloco B, 4º andar, Brasília, DF, Brasil",,,,2009-04-30,2013-04-22T09:04:54
Ministério da Defesa,MD,br/ministerio-defesa,ministerio-defesa,,Presidência da República,br/presidencia-republica,,http://www.defesa.gov.br,Brazil,BR,SIORG XML Extraction,http://repositorio.dados.gov.br/governo-politica/administracao-publica/estrutura-organizacional/,,"Esplanada dos Ministérios, Bloco Q, 6 andar, Brasília, DF, Brasil",,,,2010-11-23,2013-04-22T09:04:54
Ministério do Desenvolvimento Agrário,MDA,br/ministerio-desenvolvimento-agrario,ministerio-desenvolvimento-agrario,,Presidência da República,br/presidencia-republica,,http://www.mda.gov.br,Brazil,BR,SIORG XML Extraction,http://repositorio.dados.gov.br/governo-politica/administracao-publica/estrutura-organizacional/,,"Esplanada dos Ministérios, Bloco A, Brasília, DF, Brasil",,,,2010-08-04,2013-04-22T09:04:54
"Ministério do Desenvolvimento, Indústria e Comércio Exterior",MDIC,br/ministerio-desenvolvimento-industria-comercio-exterior,ministerio-desenvolvimento-industria-comercio-exterior,,Presidência da República,br/presidencia-republica,,http://www.desenvolvimento.gov.br,Brazil,BR,SIORG XML Extraction,http://repositorio.dados.gov.br/governo-politica/administracao-publica/estrutura-organizacional/,,"Esplanada dos Ministérios, Bloco J, Brasília, DF, Brasil",,,,2010-02-04,2013-04-22T09:04:54
Ministério do Desenvolvimento Social e Combate à Fome,MDS,br/ministerio-desenvolvimento-social-combate-a-fome,ministerio-desenvolvimento-social-combate-a-fome,,Presidência da República,br/presidencia-republica,,http://www.mds.gov.br,Brazil,BR,SIORG XML Extraction,http://repositorio.dados.gov.br/governo-politica/administracao-publica/estrutura-organizacional/,,"Esplanada dos Ministérios,  Bloco C, Brasília, DF, Brasil",,,,2011-06-02,2013-04-22T09:04:54
Ministério da Educação,MEC,br/ministerio-educacao,ministerio-educacao,,Presidência da República,br/presidencia-republica,,http://www.mec.gov.br/,Brazil,BR,SIORG XML Extraction,http://repositorio.dados.gov.br/governo-politica/administracao-publica/estrutura-organizacional/,,"Esplanada dos Ministérios, Bloco L, 7º andar , Brasília, DF, Brasil",,,,2011-05-16,2013-04-22T09:04:54
Ministério do Esporte,ME,br/ministerio-esporte,ministerio-esporte,,Presidência da República,br/presidencia-republica,,http://www.esporte.gov.br,Brazil,BR,SIORG XML Extraction,http://repositorio.dados.gov.br/governo-politica/administracao-publica/estrutura-organizacional/,,"Esplanada dos Ministérios, Bloco A, Brasília, DF, Brasil",,,,2012-08-07,2013-04-22T09:04:54
Ministério da Fazenda,MF,br/ministerio-fazenda,ministerio-fazenda,,Presidência da República,br/presidencia-republica,,http://www.fazenda.gov.br,Brazil,BR,SIORG XML Extraction,http://repositorio.dados.gov.br/governo-politica/administracao-publica/estrutura-organizacional/,,"Esplanada dos Ministérios, Bloco P, 5º andar, Brasília, DF, Brasil",,,,2011-05-16,2013-04-22T09:04:54
Ministério da Integração Nacional,MI,br/ministerio-integracao-nacional,ministerio-integracao-nacional,,Presidência da República,br/presidencia-republica,,http://www.integracao.gov.br,Brazil,BR,SIORG XML Extraction,http://repositorio.dados.gov.br/governo-politica/administracao-publica/estrutura-organizacional/,,"Esplanada dos Ministérios, Bloco E, Brasília, DF, Brasil",,,,2011-05-04,2013-04-22T09:04:54
Ministério da Justiça,MJ,br/ministerio-justica,ministerio-justica,,Presidência da República,br/presidencia-republica,,http://www.mj.gov.br/,Brazil,BR,SIORG XML Extraction,http://repositorio.dados.gov.br/governo-politica/administracao-publica/estrutura-organizacional/,,"Esplanada dos Ministérios, Bloco T, 4º Andar, Brasília, DF, Brasil",,,,2007-03-15,2013-04-22T09:04:54
Ministério do Meio Ambiente,MMA,br/ministerio-meio-ambiente,ministerio-meio-ambiente,,Presidência da República,br/presidencia-republica,,http://www.mma.gov.br,Brazil,BR,SIORG XML Extraction,http://repositorio.dados.gov.br/governo-politica/administracao-publica/estrutura-organizacional/,,"Esplanada dos Ministérios, Bloco B, 5º Andar, Brasília, DF, Brasil",,,,2007-04-26,2013-04-22T09:04:54
Ministério de Minas e Energia,MME,br/ministerio-minas-energia,ministerio-minas-energia,,Presidência da República,br/presidencia-republica,,http://www.mme.gov.br,Brazil,BR,SIORG XML Extraction,http://repositorio.dados.gov.br/governo-politica/administracao-publica/estrutura-organizacional/,,"Esplanada dos Ministérios, Bloco U, Brasília, DF, Brasil",,,,2004-11-09,2013-04-22T09:04:54
Ministério da Pesca e Aquicultura,MPA,br/ministerio-pesca-aquicultura,ministerio-pesca-aquicultura,,Presidência da República,br/presidencia-republica,,http://www.presidencia.gov.br/seap ,Brazil,BR,SIORG XML Extraction,http://repositorio.dados.gov.br/governo-politica/administracao-publica/estrutura-organizacional/,,"Esplanada dos Ministérios, Bl. D. Ed. Sede, Brasília, DF, Brasil",,,,2009-09-29,2013-04-22T09:04:54
"Ministério do Planejamento, Orçamento e Gestão",MP,br/ministerio-planejamento-orcamento-gestao,ministerio-planejamento-orcamento-gestao,,Presidência da República,br/presidencia-republica,,http://www.planejamento.gov.br,Brazil,BR,SIORG XML Extraction,http://repositorio.dados.gov.br/governo-politica/administracao-publica/estrutura-organizacional/,,"Esplanada dos Ministérios, Bloco K, Brasília, DF, Brasil",,,,2010-01-13,2013-04-22T09:04:54
Ministério da Previdência Social,MPS,br/ministerio-previdencia-social,ministerio-previdencia-social,,Presidência da República,br/presidencia-republica,,http://www.mpas.gov.br/,Brazil,BR,SIORG XML Extraction,http://repositorio.dados.gov.br/governo-politica/administracao-publica/estrutura-organizacional/,,"Esplanada dos Ministérios, Bloco F, 8º Andar, Brasília, DF, Brasil",,,,2010-01-26,2013-04-22T09:04:54
Ministério das Relações Exteriores,MRE,br/ministerio-relacoes-exteriores,ministerio-relacoes-exteriores,,Presidência da República,br/presidencia-republica,,http://www.mre.gov.br/,Brazil,BR,SIORG XML Extraction,http://repositorio.dados.gov.br/governo-politica/administracao-publica/estrutura-organizacional/,,"Esplanada dos Ministérios - Bloco H, Brasília, DF, Brasil",,,,2010-09-22,2013-04-22T09:04:54
Ministério da Saúde,MS,br/ministerio-saude,ministerio-saude,,Presidência da República,br/presidencia-republica,,http://www.saude.gov.br/,Brazil,BR,SIORG XML Extraction,http://repositorio.dados.gov.br/governo-politica/administracao-publica/estrutura-organizacional/,,"Esplanada dos Ministérios, Bloco G, 5º Andar , Brasília, DF, Brasil",,,,2010-10-19,2013-04-22T09:04:54
Ministério do Trabalho e Emprego,MTE,br/ministerio-trabalho-emprego,ministerio-trabalho-emprego,,Presidência da República,br/presidencia-republica,,http://www.mte.gov.br/,Brazil,BR,SIORG XML Extraction,http://repositorio.dados.gov.br/governo-politica/administracao-publica/estrutura-organizacional/,,"Esplanada dos Ministérios, Bloco F, 5º Andar , Gabinete, Brasília, DF, Brasil",,,,2009-11-24,2013-04-22T09:04:54
Ministério dos Transportes,MT,br/ministerio-transportes,ministerio-transportes,,Presidência da República,br/presidencia-republica,,http://www.transportes.gov.br,Brazil,BR,SIORG XML Extraction,http://repositorio.dados.gov.br/governo-politica/administracao-publica/estrutura-organizacional/,,"Esplanada dos Ministérios, Bloco R, Brasília, DF, Brasil",,,,2003-06-05,2013-04-22T09:04:54
Ministério do Turismo,MTur,br/ministerio-turismo,ministerio-turismo,,Presidência da República,br/presidencia-republica,,www.turismo.gov.br,Brazil,BR,SIORG XML Extraction,http://repositorio.dados.gov.br/governo-politica/administracao-publica/estrutura-organizacional/,,"Esplanada dos Ministérios Bl. U - Gabinete 2º, Andar Ala Norte, Brasília, DF, Brasil",,,,2008-08-25,2013-04-22T09:04:54
Nuclebrás Equipamentos Pesados S/A,NUCLEP,br/nuclebras-equipamentos-pesados-sa,nuclebras-equipamentos-pesados-sa,,Comissão Nacional de Energia Nuclear,br/comissao-nacional-energia-nuclear,,http://www.nuclep.gov.br/,Brazil,BR,SIORG XML Extraction,http://repositorio.dados.gov.br/governo-politica/administracao-publica/estrutura-organizacional/,,"Av. Marechal Câmara, 160 - Sl. 833 - CASTELO, Rio de Janeiro, RJ, Brasil",,,,2003-05-12,2013-04-22T09:04:54
Petróleo Brasileiro S.A.,PETROBRAS,br/petroleo-brasileiro-sa,petroleo-brasileiro-sa,,Ministério de Minas e Energia,br/ministerio-minas-energia,,http://www.petrobras.com.br/,Brazil,BR,SIORG XML Extraction,http://repositorio.dados.gov.br/governo-politica/administracao-publica/estrutura-organizacional/,,"Avenida República do Chile Nº 65 , EDifício M.Adenar de Queiroz, 23ºAndar, Rio de Janeiro, RJ, Brasil",,,,2003-03-21,2013-04-22T09:04:54
Secretaria de Assuntos Estratégicos da Presidência da República,SAE/PR,br/secretaria-assuntos-estrategicos-presidencia-republica,secretaria-assuntos-estrategicos-presidencia-republica,,Presidência da República,br/presidencia-republica,,http://www.sae.gov.br/,Brazil,BR,SIORG XML Extraction,http://repositorio.dados.gov.br/governo-politica/administracao-publica/estrutura-organizacional/,,"Esplanada dos Ministérios Bloco O 8º Andar , Brasília, DF, Brasil",,,,2008-07-28,2013-04-22T09:04:54
Secretaria de Aviação Civil da Presidência da República,SAC,br/secretaria-aviacao-civil-presidencia-republica,secretaria-aviacao-civil-presidencia-republica,,Presidência da República,br/presidencia-republica,,http://www.aviacaocivil.gov.br/,Brazil,BR,SIORG XML Extraction,http://repositorio.dados.gov.br/governo-politica/administracao-publica/estrutura-organizacional/,,"Centro Cultural Banco do Brasil (CCBB), Setor de Clubes Sul, trecho 2, lote 22, Portaria 1, 1º Andar, Brasília, DF, Brasil",,,,2011-03-18,2013-04-22T09:04:54
Secretaria de Comunicação Social da Presidência da República,SECOM-PR,br/secretaria-comunicacao-social-presidencia-republica,secretaria-comunicacao-social-presidencia-republica,,Presidência da República,br/presidencia-republica,,,Brazil,BR,SIORG XML Extraction,http://repositorio.dados.gov.br/governo-politica/administracao-publica/estrutura-organizacional/,,"Palácio do Planalto, Praça dos Três Poderes, Brasília, DF, Brasil",,,,2008-02-19,2013-04-22T09:04:54
Secretaria de Direitos Humanos da Presidência da República,SDH,br/secretaria-direitos-humanos-presidencia-republica,secretaria-direitos-humanos-presidencia-republica,,Presidência da República,br/presidencia-republica,,https://www.presidencia.gov.br/sedh/,Brazil,BR,SIORG XML Extraction,http://repositorio.dados.gov.br/governo-politica/administracao-publica/estrutura-organizacional/,,"Esplanada dos Ministérios - Bloco T - Sala 420 - Edifício Sede do Ministério da Justiça, Brasília, DF, Brasil",,,,2010-08-04,2013-04-22T09:04:54
Secretaria-Geral da Presidência da República,SGPR,br/secretaria-geral-presidencia-republica,secretaria-geral-presidencia-republica,,Presidência da República,br/presidencia-republica,,http://www.presidencia.gov.br/SecGeral,Brazil,BR,SIORG XML Extraction,http://repositorio.dados.gov.br/governo-politica/administracao-publica/estrutura-organizacional/,,"Pça. dos Três Poderes, Palácio do Planalto , 4º Andar, Brasília, DF, Brasil",,,,2008-02-19,2013-04-22T09:04:54
Secretaria de Políticas para as Mulheres da Presidência da República,SPM,br/secretaria-politicas-mulheres-presidencia-republica,secretaria-politicas-mulheres-presidencia-republica,,Presidência da República,br/presidencia-republica,,http://www.presidencia.gov.br/spmulheres/fale/,Brazil,BR,SIORG XML Extraction,http://repositorio.dados.gov.br/governo-politica/administracao-publica/estrutura-organizacional/,,"Esplanada dos Ministérios Bloco L - Ed. Sede , 2º andar sala 200, Brasília, DF, Brasil",,,,2009-12-22,2013-04-22T09:04:54
Secretaria de Políticas de Promoção da Igualdade Racial da Presidência da República,SEPPIR,br/secretaria-politicas-promocao-igualdade-racial-presidencia-republica,secretaria-politicas-promocao-igualdade-racial-presidencia-republica,,Presidência da República,br/presidencia-republica,,https://www.presidencia.gov.br/seppir/,Brazil,BR,SIORG XML Extraction,http://repositorio.dados.gov.br/governo-politica/administracao-publica/estrutura-organizacional/,,"Esplanada dos Ministérios, Bloco A , 9º andar, Brasília, DF, Brasil",,,,2010-08-12,2013-04-22T09:04:54
Secretaria de Portos da Presidência da República,SEP,br/secretaria-portos-presidencia-republica,secretaria-portos-presidencia-republica,,Presidência da República,br/presidencia-republica,,,Brazil,BR,SIORG XML Extraction,http://repositorio.dados.gov.br/governo-politica/administracao-publica/estrutura-organizacional/,,"Brasília, DF, Brasil",,,,2010-08-12,2013-04-22T09:04:54
Secretaria de Relações Institucionais da Presidência da República,SRIPR,br/secretaria-relacoes-institucionais-presidencia-republica,secretaria-relacoes-institucionais-presidencia-republica,,Presidência da República,br/presidencia-republica,,http://www.planalto.gov.br,Brazil,BR,SIORG XML Extraction,http://repositorio.dados.gov.br/governo-politica/administracao-publica/estrutura-organizacional/,,"Praça dos Três Poderes, Palácio do Planalto, 4º Andar, Brasília, DF, Brasil",,,,2007-09-18,2013-04-22T09:04:54
Serviço Federal de Processamento de Dados,SERPRO,br/servico-federal-processamento-dados,servico-federal-processamento-dados,,Ministério da Fazenda,br/ministerio-fazenda,,http://www.serpro.gov.br/,Brazil,BR,SIORG XML Extraction,http://repositorio.dados.gov.br/governo-politica/administracao-publica/estrutura-organizacional/,,"SERPRO/Sede - SGAN 601- MODULO V, Brasília, DF, Brasil",,,,2003-03-24,2013-04-22T09:04:54
Superintendência do Desenvolvimento da Amazônia,SUDAM,br/superintendencia-desenvolvimento-amazonia,superintendencia-desenvolvimento-amazonia,,Ministério da Integração Nacional,br/ministerio-integracao-nacional,,www.mi.gov.br,Brazil,BR,SIORG XML Extraction,http://repositorio.dados.gov.br/governo-politica/administracao-publica/estrutura-organizacional/,,"Av. Almirante Barroso, 426, Belém, PA, Brasil",,,,2007-10-04,2013-04-22T09:04:54
Superintendência de Desenvolvimento do Centro-Oeste,SUDECO,br/superintendencia-desenvolvimento-centro-oeste,superintendencia-desenvolvimento-centro-oeste,,Ministério da Integração Nacional,br/ministerio-integracao-nacional,,www.mi.gov.br,Brazil,BR,SIORG XML Extraction,http://repositorio.dados.gov.br/governo-politica/administracao-publica/estrutura-organizacional/,,"Av. Almirante Barroso, 426, Brasil",,,,2009-01-08,2013-04-22T09:04:54
Superintendência do Desenvolvimento do Nordeste,SUDENE,br/superintendencia-desenvolvimento-nordeste,superintendencia-desenvolvimento-nordeste,,Ministério da Integração Nacional,br/ministerio-integracao-nacional,,www.sudene.gov.br- ,Brazil,BR,SIORG XML Extraction,http://repositorio.dados.gov.br/governo-politica/administracao-publica/estrutura-organizacional/,,"Praça Ministro João Gonçalves de Souza, s/n, Ed. Sudene, Engenho do Meio, Recife, PE, Brasil",,,,2007-10-04,2013-04-22T09:04:54
Superintendência Nacional de Previdência Complementar,PREVIC,br/superintendencia-nacional-previdencia-complementar,superintendencia-nacional-previdencia-complementar,,Ministério da Previdência Social,br/ministerio-previdencia-social,,,Brazil,BR,SIORG XML Extraction,http://repositorio.dados.gov.br/governo-politica/administracao-publica/estrutura-organizacional/,,", Brasil",,,,2010-01-16,2013-04-22T09:04:54
Superintendência de Seguros Privados,SUSEP,br/superintendencia-seguros-privados,superintendencia-seguros-privados,,Ministério da Fazenda,br/ministerio-fazenda,,http://www.susep.gov.br/faleconosco.asp,Brazil,BR,SIORG XML Extraction,http://repositorio.dados.gov.br/governo-politica/administracao-publica/estrutura-organizacional/,,"Rua Buenos Aires, 256, 4º andar, Rio de Janeiro, RJ, Brasil",,,,2009-12-23,2013-04-22T09:04:54
Superintendência da Zona Franca de Manaus,SUFRAMA,br/superintendencia-zona-franca-manaus,superintendencia-zona-franca-manaus,,"Ministério do Desenvolvimento, Indústria e Comércio Exterior",br/ministerio-desenvolvimento-industria-comercio-exterior,,http://www.suframa.gov.br,Brazil,BR,SIORG XML Extraction,http://repositorio.dados.gov.br/governo-politica/administracao-publica/estrutura-organizacional/,,"Av. Ministro João Gonçalves de Souza, s/n, Manaus, AM, Brasil",,,,2010-03-29,2013-04-22T09:04:54
Telecomunicações Brasileiras S.A.,TELEBRÁS,br/telecomunicacoes-brasileiras-sa,telecomunicacoes-brasileiras-sa,,Ministério das Comunicações,br/ministerio-comunicacoes,,http://www.telebras.gov.br,Brazil,BR,SIORG XML Extraction,http://repositorio.dados.gov.br/governo-politica/administracao-publica/estrutura-organizacional/,,"SCN - Quadra 04 - Bl B Sala 903  , Centro Empresarial, Brasília, DF, Brasil",,,,1972-07-11,2013-04-22T09:04:54
Universidade Federal de Alagoas,UFAL,br/universidade-federal-alagoas,universidade-federal-alagoas,,Ministério da Educação,br/ministerio-educacao,,http://www.ufal.br,Brazil,BR,SIORG XML Extraction,http://repositorio.dados.gov.br/governo-politica/administracao-publica/estrutura-organizacional/,,"Campus  A .C. Simões, BR 104, Km 14, Bloco 12, Maceió, AL, Brasil",,,,1961-01-25,2013-04-22T09:04:54
Universidade Federal de Alfenas,UNIFAL-MG,br/universidade-federal-alfenas,universidade-federal-alfenas,,Ministério da Educação,br/ministerio-educacao,,http://www.unifal-mg.edu.br/,Brazil,BR,SIORG XML Extraction,http://repositorio.dados.gov.br/governo-politica/administracao-publica/estrutura-organizacional/,,"Rua Gabriel Monteiro da Silva, 714, Centro, Alfenas, MG, Brasil",,,,1960-12-18,2013-04-22T09:04:54
Universidade Federal da Bahia,UFBA,br/universidade-federal-bahia,universidade-federal-bahia,,Ministério da Educação,br/ministerio-educacao,,http://www.ufba.br,Brazil,BR,SIORG XML Extraction,http://repositorio.dados.gov.br/governo-politica/administracao-publica/estrutura-organizacional/,,"Rua Augusto Viana, S/N, Palácio da Reitoria, Salvador, BA, Brasil",,,,1946-04-08,2013-04-22T09:04:54
Universidade Federal de Campina Grande,UFCG,br/universidade-federal-campina-grande,universidade-federal-campina-grande,,Ministério da Educação,br/ministerio-educacao,,http://www.ufcg.edu.br/principal.html,Brazil,BR,SIORG XML Extraction,http://repositorio.dados.gov.br/governo-politica/administracao-publica/estrutura-organizacional/,,"Setor de Administração Federal Sul, Lote 01 , Brasil",,,,2002-04-09,2013-04-22T09:04:54
Universidade Federal do Ceará,UFC,br/universidade-federal-ceara,universidade-federal-ceara,,Ministério da Educação,br/ministerio-educacao,,www.ufc.br,Brazil,BR,SIORG XML Extraction,http://repositorio.dados.gov.br/governo-politica/administracao-publica/estrutura-organizacional/,,"Avenida da Universidade, 2853 - Benfica, Fortaleza, CE, Brasil",,,,1954-12-16,2013-04-22T09:04:54
Universidade Federal do Espírito Santo,UFES,br/universidade-federal-espirito-santo,universidade-federal-espirito-santo,,Ministério da Educação,br/ministerio-educacao,,http://www.ufes.br/,Brazil,BR,SIORG XML Extraction,http://repositorio.dados.gov.br/governo-politica/administracao-publica/estrutura-organizacional/,,"Avenida Fernando Ferrari, S/n, Campus Universitári, Vitória, ES, Brasil",,,,1961-01-30,2013-04-22T09:04:54
Universidade Federal do Estado do Rio de Janeiro,UNIRIO,br/universidade-federal-estado-rio-janeiro,universidade-federal-estado-rio-janeiro,,Ministério da Educação,br/ministerio-educacao,,http://www.unirio.br/,Brazil,BR,SIORG XML Extraction,http://repositorio.dados.gov.br/governo-politica/administracao-publica/estrutura-organizacional/,,"Avenida Pasteur, 296, Rio de Janeiro, RJ, Brasil",,,,1979-06-05,2013-04-22T09:04:54
Universidade Federal Fluminense,UFF,br/universidade-federal-fluminense,universidade-federal-fluminense,,Ministério da Educação,br/ministerio-educacao,,http://www.uff.br,Brazil,BR,SIORG XML Extraction,http://repositorio.dados.gov.br/governo-politica/administracao-publica/estrutura-organizacional/,,"Rua Miguel de Frias, 9, 7 Andar, Niterói, RJ, Brasil",,,,1960-12-18,2013-04-22T09:04:54
Universidade Federal da Fronteira Sul,UFFS,br/universidade-federal-fronteira-sul,universidade-federal-fronteira-sul,,Ministério da Educação,br/ministerio-educacao,,,Brazil,BR,SIORG XML Extraction,http://repositorio.dados.gov.br/governo-politica/administracao-publica/estrutura-organizacional/,,"Chapecó, SC, Brasil",,,,2009-09-15,2013-04-22T09:04:54
Universidade Federal de Goiás,UFG,br/universidade-federal-goias,universidade-federal-goias,,Ministério da Educação,br/ministerio-educacao,,http://www.ufg.br,Brazil,BR,SIORG XML Extraction,http://repositorio.dados.gov.br/governo-politica/administracao-publica/estrutura-organizacional/,,"Rod. Goiânia - Nerópolis, km 12 Prédio da Reitoria, Goiânia, GO, Brasil",,,,1960-12-14,2013-04-22T09:04:54
Universidade Federal da Integração Latino-Americana,UNILA,br/universidade-federal-integracao-latino-americana,universidade-federal-integracao-latino-americana,,Ministério da Educação,br/ministerio-educacao,,http://www.unila.ufpr.br/,Brazil,BR,SIORG XML Extraction,http://repositorio.dados.gov.br/governo-politica/administracao-publica/estrutura-organizacional/,,"Av. Tancredo Neves, 6731, Bloco 4, Foz do Iguaçu, PR, Brasil",,,,2010-01-12,2013-04-22T09:04:54
Universidade Federal de Itajubá,UNIFEI,br/universidade-federal-itajuba,universidade-federal-itajuba,,Ministério da Educação,br/ministerio-educacao,,www.unifei.edu.br,Brazil,BR,SIORG XML Extraction,http://repositorio.dados.gov.br/governo-politica/administracao-publica/estrutura-organizacional/,,"Avenida BPS, 1303, Campus Prof. Jose Rodrigues Seabra, Caixa Postal 50, Itajubá, MG, Brasil",,,,1956-01-30,2013-04-22T09:04:54
Universidade Federal de Juiz de Fora,UFJF,br/universidade-federal-juiz-fora,universidade-federal-juiz-fora,,Ministério da Educação,br/ministerio-educacao,,http://www.ufjf.br,Brazil,BR,SIORG XML Extraction,http://repositorio.dados.gov.br/governo-politica/administracao-publica/estrutura-organizacional/,,"Rua Benjamin Constant, 790, Centro, Juiz de Fora, MG, Brasil",,,,1960-12-23,2013-04-22T09:04:54
Universidade Federal de Lavras,UFLA,br/universidade-federal-lavras,universidade-federal-lavras,,Ministério da Educação,br/ministerio-educacao,,http://www.ufla.br/,Brazil,BR,SIORG XML Extraction,http://repositorio.dados.gov.br/governo-politica/administracao-publica/estrutura-organizacional/,,"Campus Universitário, Pavilhão Central, Lavras, MG, Brasil",,,,1963-12-23,2013-04-22T09:04:54
Universidade Federal de Minas Gerais,UFMG,br/universidade-federal-minas-gerais,universidade-federal-minas-gerais,,Ministério da Educação,br/ministerio-educacao,,http://www.ufmg.br,Brazil,BR,SIORG XML Extraction,http://repositorio.dados.gov.br/governo-politica/administracao-publica/estrutura-organizacional/,,"Avenida Antonio Carlos , 6627 - Reitoria - Campus, Belo Horizonte, MG, Brasil",,,,1949-12-16,2013-04-22T09:04:54
